ID,LESSON,SUBJECT,TITLE,TIMESTAMP,VOLUME,PAGE,DESCRIPTION,BOOK_DESCRIPTION,INVENTOR
297,31-1,Rope Magic,Ted Collins' Panama Rope Mystery,0:48:46,2,368,"Rope is cut to make 2 pieces of rope.  They are tied together.  1 loop is tied at each end of the new ""long"" rope.  Rope is cut at knots to free loops.  Rope now has 3 knots on it.  It is wrapped around magician's hand.  When rope is unwrapped, knots have vanished.",A system of interlaced knots are untied even though the ends are held by a spectator. Rope,Ted Collins
298,31-2,Rope Magic,Christopher's Cigarette to Rope,0:00:00,2,349,"Lit cigarette to rope;  Another lit cigarette to rope; Card box turns to cigarette pack. Rope is pulled out. Cigarette pack is turned back to card box and card deck is pulled out and a card is chosen.  Cards are placed back into box and when shaken, a silk is pulled out of box and cards have vanished. ","Two ends are tied, and the loop shown. It is double coiled and cut, and the knot is cut away. Rope is tied again. The knot disappears, healing the rope.",NONE
299,31-2,Rope Magic,Tarbell's Triple Chefalo Knot,0:15:01,2,358,How to tie a knot that's not a knot (Dealing with difficulties and getting out of them),A false knot that does not have to be slid off.,Tarbell
300,31-2,Rope Magic,"Another Rope Routine (Magician's Cut and Restored Rope, Perplexo Cut and Restored Rope, Himber's Rope Mystery, A Novel Knot Steal)",0:24:13,---,---,"Magician cuts rope, ties knot and restores rope. Rope is cut again and instantly restored. Rope is cut, yet again, and again restored. Knot is tied in center of rope and THEN cut, and rope is again restored. ","Rope is brought up in a loop and cut, both pieces being shown. The rope is restored.",NONE
301,32-1,Ghostlite Mysteries,Ghostlight Mysteries Routine Performance,0:00:10,2,373,"Spectator selects a children toy block with a letter on it at random. They remember that letter.  Another spectator, without knowing the letter selected, eliminates blocks down to 1.  It is the 1 the spectator selected and it matches a newspaper clipping about a boy that died years ago whose name begins with the same letter. Spectator selects an item that was a posession of someone from long ago. Spectator writes name of someone they know on slate. From deck of cards, they select a card without looking at it and place it in an envelope.  The other items of posession go in the bag with the toy blocks. The selected item goes into a pocket. Magician and spectator place hands on the table. Spectator turns off lamp, making theater go dark. In the dark, 3 glowing diamonds appear floating in air. The light is turned back on and the random card is shown to be the 3 of diamonds. The name is erased from the slate. The light is turned back off. A glowing spider appears and crawls on spectator. Chalk glows and is seen to write on slate by itself. Light goes back on. A message is now on the slate saying, ""Careful, I'm watching - ""name of person spectator thought of and erased"""".  Lights are turned back off and ghostly figure appears floating.  Lights are turned back on. Item from pocket is now on picture. Lights go back out and glowing work appears.  Scary glowing face appears. Lights are turned back on. Everything is gone. ",Floating pips in the dark form the selected card.,NONE
302,32-2,Ghostlite Mysteries,Ghostlight Mysteries Chair Performance,0:00:10,2,373,"Magician sits in chair, spectators hold magician's wrists tightly. Lights go out. Glowing face appears and vanishes. Light comes back on. Spectators are still holding magician's wrists. This time they also hold his knees. ","As above, revealing the date.",NONE
303,32-3,Ghostlite Mysteries,Ghostlight Mysteries Routine Performance (Night-vision),0:00:10,2,373,A night-vision view of the full routine performance and chair performance.,a forced word from a book revealed.,NONE
304,32-4,Ghostlite Mysteries,Introduction and Props,0:00:09,2,373,Props and routine explanation of both performances. ,use a glowing alphabet.,NONE
305,33-1,Illusions,The Mystery of King Tut #1,0:00:00,2,387,"3 paintings are set up in a triangle. Woman appears from center of them.  When trick is repeated, this time, magician appears out of triangle and assistant is magician.",Magician wraps self in blanket to mimic mummy. Assistant protests and show magician how to do it. A man from audience joins and the three argue. Suddenly the man removes his costume and is found to be the assistant. The blanket is opened and a girl appears!,NONE
306,33-2,Illusions,Who and Which #2,0:00:00,2,395,"$20 is clipped to a Star Wand in center of stage. Spectator is blindfolded and wrapped in cloth and informed that if they can knock over wand, they get $20. As they wobble toward the wand, magician cheats and picks up wand, guiding spectator in the wrong direction.  After a little bit, spectator appears in back of audience, comes to front and grabs $20. Wrapped up spectator is unwrapped to reveal surprise assistant.","Hindu magician ties girl in sack and places screen around her. After moving around a bit, the sack is opened and found to be the magician, the Hindu costume is removed and found to be the girl.",NONE
307,33-3,Illusions,Three Kings and a Queen #3,0:00:00,2,403,"Circular time device is wheeled onto stage. There is a bodybag connected to it. Magician gets into full hazard suit. Assistant gets into safety vest. Assistant gets into bodybag and sticks hands out of bag. Magician operates time device. Something appears to go wrong, Magician removes hazard gear to reveal he is now assistant.  Bodybag is opened to reveal assistant is now magician. ",Three large playing cards are held flat and carried one at a time to center of stage. A real 'queen' appeared from within them!,NONE
308,33A-1,Mental Magic,The Optical Force,0:00:09,2,408,"4 cards are chosen at random (1 by magician, 3 by spectators). All cards are the exact same (all 5's).",two spectators choose cards,NONE
309,33A-1,Mental Magic,Demon Digits,0:06:13,2,409,"3 digits are thought of by the spectator (all different digits). The numbers are reversed, then both numbers are subtracted.  Total is written down.  Magician uses playing cards to reveal all 3 digits of the total. ","calculation procedure, result predicted",NONE
310,33A-1,Mental Magic,Ultra Die,0:18:54,2,410,Magician draws something on business card and folds business card and hands it to spectator to keep safe. 6 cards are randomly selected from shuffled deck. The 6 cards are placed face down in random places in the deck. A die is rolled and the number that comes up on the die is the face down card removed for the prediction. It matches what he wrote in the beginning.,"strange card prediction, chosen by rolling a die",NONE
311,33A-1,Mental Magic,The Folded Prophecy,0:33:27,2,412,"Greeting card inside envelope is passed around the audience. When it randomly stops, audience member who has it comes up. The card is pulled out and it has the letter of the persons middle name.","nail writer, through envelope, carbon paper",NONE
312,33A-1,Mental Magic,Liars Convention,0:43:57,2,412,"After cutting the cards several times, the top 3 cards are pulled off the deck by 3 spectators. The spectators decide which card to show to the audience. 1 spectator shows their card, the other 2 switch their cards. All 3 make sure their cards are face down.  The magician then attempts to divise who showed the card via vocal inflection. The magician then proceeds to divine the exact card.  Deck is cut again. Each spectator takes a new card. Again 1 spectator shows a card. Again, the magician is able to divine who showed and what the card is.  Trick is repeated a 3rd time. ","magician blindfolded, three spectators choose cards two exchange cards, magicican knows who and the cards, marked stacked deck",NONE
313,33A-1,Mental Magic,Clocks and Cards,1:21:16,2,414,Spectator draws hands on an analog clock representing the time they were born. Assistant receives your watch and uses dials to turn hands to spectator's birth time. A playing card is drawn in under the clock. The assistant is handed a shuffled deck of cards.  Assistant removes 1 card...  It matches drawn card.,"clock time duplication, then drawn card is found by medium",NONE
314,33A-1,Mental Magic,Roughing It,1:41:17,2,416,"5 cards are removed from deck and the deck is turned face up. Spectator remembers 1 of the 5 cards and mixes the packet up.  Spectator then places the 5 face down cards into the face up deck anywhere randomly.  Behind his back, magician locates the face down cards and flips 4 of them over leaving only 1 face down - the spectator's thought of card.",mental reverse variant,NONE
315,34-1,Routining a Magic Show,Introduction,0:00:09,3,21,---,essay,NONE
316,34-1,Routining a Magic Show,The Secret to a Better Routine,0:04:06,---,---,---,essay,NONE
317,34-1,Routining a Magic Show,Scripting,0:27:01,---,---,---,essay,NONE
318,34-1,Routining a Magic Show,Choosing Material,0:40:17,---,---,---,essay,NONE
319,34-1,Routining a Magic Show,Putting it in Order,0:48:46,---,---,---,essay,NONE
320,34-1,Routining a Magic Show,Technical Considerations,1:03:40,---,---,---,essay,NONE
321,34-1,Routining a Magic Show,Acting,1:13:34,---,---,---,essay,NONE
322,35-1,How to Make People Laugh,How To Make People Laugh,0:00:00,3,35,---,Basis of Magic and Laughter,NONE
323,36-2,Intimate Magic,"Christopher's ""Double Cross""",0:00:09,3,53,"Spectator is asked to think of 4 letter words and imagine that those words appear on a blank business card. The spectator says he can see them appearing, but the audience sees just blank business cards.  The spectator holds 4 blank cards and a crayon. Spectator imagines writing each letter of the word he thought of on each of the cards in his hands. When revealed, the letters of his thought of word have been written on his cards.  ","Paper torn into 8 pieces and placed in two piles. Spectator selects one pile, magician draws crosses on each of the other papers. These are burnt. Spectator's papers now have crosses.",NONE
324,36-2,Intimate Magic,"Joe Berg's ""Double Cross""",0:13:27,3,56,Spectator cuts shuffled deck and looks at top card. Magician spreads an invisible deck out in front of Spectator B and gets Them to name the card.,"Palm is shown empty, cardboard is placed on top and two crosses are marked on the cardboard and erased. When removed, the crosses have transferred to the palm.",NONE
325,36-2,Intimate Magic,Tarbell's Sugar Mark,0:29:42,3,58,"Spectator opens sugar pack, magician pours it in hand and transforms it to sugar cube. Spectator writes initials on it.  Magician places sugar cube in water and places spectator's hands over water.  Spectator's initials appear on the spectator's hands in different places.",A mark made on a sugar lump transfers to a plate.,NONE
326,36-2,Intimate Magic,Christopher's Match Book and Coin,0:38:40,3,61,Matches are removed from matchbook and matchbook is torn in half.  Halves are rubbed together and quarter appears between them. Halves are then torn in half again.  Spectator rubs 2 halves together and magician rubs 2 other halves.  Quarter appears between magician's halves.  Magician takes halves from spectator and rubs them together to produce another quarter.  1 of the quarters is rolled up and when it is unrolled a quarter is found inside it.,A coin is produced from a paper match book,NONE
327,36-2,Intimate Magic,Christopher's Match Stickler,0:48:31,3,63,"1 match is removed from matchbook, burnt, and blown out so head of match is now blackened. Match disappears and reappears inside matchbook.  5 matches are then torn out, 1 match is used to light all the other matches left in matchbook (Spectator is holding the 5 that were torn out). Magician grabs the 5 matches and 1 at a time, places them into the spectator's hand. On the 5th one, spectator closes their hand.  Spectator waves matchbook over their hand. 1 match disappears and reappears inside matchbook with burnt matches.","Matches in book are counted. One is removed and burnt. It is found back in the book, but burnt!",NONE
328,36-2,Intimate Magic,Audley Walsh Match Routine,1:00:22,3,65,"2 matches appears at magician's fingertips.  1 disappears, then reappears.  It disappears again and  reappears. 1 match causes another 1 to jump off magician's hand.  The match disappears then reappears.  Both matches then penetrate each other several times. Match is lit, blown out, Magician makes a gun with his fingers and ""shoots"" at the match and the head falls off. ",A sort of multiplying match sticks routine,NONE
329,36-2,Intimate Magic,Match Through Safety Pin,1:11:05,3,68,Optical illusion to teach kids that some things move faster than the eye and brain can work.  Looks like match goes through a safety pin.  (Science),A match penetrates the metal of a safety pin,NONE
330,36-2,Intimate Magic,Match on Edge,1:16:06,3,70,"Several spectator are given matches from a matchbook. They are challenged to cause the match to drop on it edge (long edge). None can do it.  Magician grabs one of them and does it first try by ""cheating"" (slightly bends the match prior to dropping it). Then he grabs another and ""adds magic"" to it and has that spectator drop it.  When they drop it, the match is seen to have split in half.",Bar bet to have a match stand on its edge,NONE
331,36-2,Intimate Magic,Rising and Falling Match,1:20:25,3,71,"Match torn out of matchbook is lit and dropped in bottle of water.  More water is poured into bottle to ""top it off"". Match floats in bottle. At magician's command, match sinks to bottom.  At magician's command, match rises.  It does either all at magician's control, even floating in middle of bottle.  (Science)",Match rises and falls at will in pop bottle of water,NONE
332,36-2,Intimate Magic,A Button off the Vest,1:32:16,3,72,Circular pendant on necklace being held on by bridal hitch is quickly removed and replaced. ,An impromptu tearing off and restoration of a spectator's button,NONE
333,36-1,Intimate Magic,Tavern Trickery,0:00:09,3,75,Quarter is borrowed and placed in spectator's hands. Spectator cuts card deck and card they cut to is placed face up on table. Quarter is shaken in hands. Quarter is flipped by spectator to reveal the card is now written on borrowed quarter. Another card is selected. That card is now written on the other side of the quarter. ,A card is revealed by the inside of a bottle cap previously shown empty,NONE
334,36-1,Intimate Magic,Christopher's Finger Tip Telepathy,0:08:41,3,76,"Spectator A selects a card. Spectator B is able to name whether it's red or black, then the suit, then the value. Spectator A confirms all then shows the card.  ",A spectator predicts another spectator's card,NONE
335,36-1,Intimate Magic,The Phantom Safety Pin,0:14:17,3,79,Safety pin stuck in handkerchief is moved without ripping cloth. ,A safety pin is torn along a handkerchief without harming it.,NONE
336,36-1,Intimate Magic,"Ring Rope and Pin, Tom Osbornes Spirit Knot, Ring and the Knot",0:18:49,3,81,"Rope is laid on table with ends hanging off.  Borrowed ring is laid next to it. Handkerchief is used to cover it. Magician's hands go under handkerchief and ring is placed onto rope (without using ends). It is done again but this time, there is a knot placed in rope and ring is tied into knot.  Magician again ties knot and makes ring penetrate rope and ring ends up tied to knot on rope.",A ring is placed on a rope under a handkerchief while the ends are in view.,NONE
337,36-1,Intimate Magic,A Fountain Pen Nifty,0:35:35,3,88,Sharpie cap vanishes from hand and appears back on Sharpie,"As above, without using a safety pin.",NONE
338,36-1,Intimate Magic,Joe Berg's Criss-Cross Paper Napkin,0:37:46,3,89,Half of napkin is balled up and covered by spectator. Other half is torn into pieces and balled up then magically switched with spectator's piece.  Then the whole napkin is restored.  ,"A ring is threaded on a rope, and instantly becomes knotted upon it",NONE
339,36-1,Intimate Magic,Psychometric Crayons,0:45:57,3,94,"Magician hands 3 crayons to child. He miscalls the incorrect color each time. 1 crayon is placed into magician's hands, other 2 are placed behind child's back. Magician guesses the correct color in his hand.  This time child places 2 crayons in magician's hand and thinks about the 1 behind his own back.  Magician gets it correct.  Child places all crayons in magician's hands. Magician tries to remember the colors of the crayons behind his back.  Child requests any color crayon and magician instantly pulls it out.  ","The cap of a fountain pen disappears, to reappear back on the pen",NONE
340,36-1,Intimate Magic,"Nifty Knots, Vanishing Knot Flourishes",0:59:07,3,96/99,"A knot appears and disappears in a rope, finally ending with 2 knots appearing in the rope.","Napkin torn into four. Two are torn and rolled, other two are just rolled. Two torn exchange with two untorn pieces. Torn pieces then restore themselves. Finally, all are rolled and restore into the original napkin. Close-up",NONE
341,36-1,Intimate Magic,G.W. Hunter's Puzzle Knot,1:11:11,3,101,"Magician challenges child to attempt to tie a knot in a rope without letting go of the ends. After child can't do it, Magician does it several times including with the child holding 1 end, then both ends.",A Crayon is placed in tube and placed behind performer's back. The performer detects the color. This is repeated.,NONE
342,36-1,Intimate Magic,Bachelor's Needle,1:18:56,3,102,Rope penetrates itself like threading the eye of a needle.,Knots instantly appear in a rope,NONE
343,37-1,Conjuring with Currency,John Scarne's Bill Change,0:00:09,3,106,$1 turns into $100.  $1 is now found in change purse.  ,A bill switch,NONE
344,37-1,Conjuring with Currency,Grant's Slow Motion Bill Transposition,0:09:38,3,109,"Spectator folds their $1 as magician folds their $20. Magician takes both. Both go in spectator's hand and magician pulls out $1. $1 turns into $20.  When spectator opens his hand, he is holding $1.",Nice $1 and $5 change,NONE
345,37-1,Conjuring with Currency,"Grant's ""Million Dollar"" Bill Mystery",0:19:36,3,112,,"Two bills torn, one half of each given to two spectators. Other halves are vanished, and envelope produced. Envelope is opened, and two halves match the ones held by the spectators.",NONE
346,37-1,Conjuring with Currency,The Persnickety Pinochle Player,0:43:54,3,115,,Comedy version of Million Dollar Bill Mystery using two Aces of Diamonds.,NONE
347,37-1,Conjuring with Currency,Novel Burned and Restored Bill,0:57:12,3,116,,"Bill is burned on top of overturned saucer. When saucer is lifted, the restored bill is found.",NONE
348,37-1,Conjuring with Currency,Half and Half,1:13:16,3,118,,"Bill is placed in envelope; envelope is signed inside and out and sealed. Envelope is cut into two, and so is the bill, as demonstrated when two half dollars are poured from the envelope.",NONE
349,37-1,Conjuring with Currency,The Life Saver,1:23:31,3,122,,Vanished bill found inside Life Savers candy pack. Two versions.,NONE
350,37-1,Conjuring with Currency,Le Paul's Torn Bill & Sign-A-Bill,1:41:54,3,126/135,,"Dollar is borrowed and torn in two. Magician gives spectator half, which turns out to be a half dollar coin. Magician takes half dollar back and restores the bill.",NONE
351,37-1,Conjuring with Currency,"A Dollar Makes a ""Break"" & The Topsy-Turvy Bill",1:47:56,3,127/129,,"A dollar bill is used to strike and break a pencil, but the dollar breaks instead and drops change on the floor. Finally, another dollar is tried using a stunt and breaks the pencil.",NONE
352,37-1,Conjuring with Currency,Berland's One to Four,2:13:39,3,130,,"A bill is shown and folded cleanly. When unfolded, the bill has turned upside down.",NONE
353,37-1,Conjuring with Currency,Making Money to Order,2:18:49,3,133,,"A dollar bill is cut into four, and four full dollars are produced, one from each piece.",NONE
354,37-1,Conjuring with Currency,Instant Number Memorization,2:26:23,3,134,,Similar to One to Four using Newspaper,NONE
355,37-1,Conjuring with Currency,A Roll of Bills,2:47:41,3,136,,How to quickly memorize dollar serial number for a quick stunt,NONE
356,38-1,Modern Coin Effects,Manuel's Coin Star,0:00:09,3,137,,Stack of 4 coins opens between the fingers,NONE
357,38-1,Modern Coin Effects,The Four Coin Flourish,0:05:18,3,139,,Flourish with one coin,NONE
358,38-1,Modern Coin Effects,The Coin Roll,0:08:38,3,140,,"dime, nickle, quarter, and half rapidly produced",NONE
359,38-1,Modern Coin Effects,Al Zink's Coin Production,0:11:49,3,142,,"Dime placed on back of magician's hand and covered with a Half Dollar. Half is removed and dime has vanished, to be found inside the hand. Only one dime and half used.",NONE
360,38-1,Modern Coin Effects,Combo Coin Routine,0:20:34,---,---,,Copper/Silver tranposition using one copper and one silver,NONE
361,38-1,Modern Coin Effects,Paul Morris' Ubiquitous Coin & Back and Forth,0:57:31,3,153/155,,Silver dollar and dime transform repeatedly at the fingertips,NONE
362,38-1,Modern Coin Effects,Coin Through the Handkerchief,1:15:06,3,159,,Coin vanish using sleeving,NONE
363,38-1,Modern Coin Effects,"French ""Pill Box"" Coin Mystery",1:20:26,3,160,,variation of above used as coin change,NONE
364,38-1,Modern Coin Effects,Coins in a Loaf of Bread,1:40:21,3,164,,Impromptu 2 coin routine. Can be combined with Back and Forth or used alone. Uses sleeving and French Drop. With rhyming patter.,NONE
365,38-1,Modern Coin Effects,Okito Coin Box,1:50:50,3,166,,"A continuation of Paul Morris' Ubiquitous Coin, or can be used alone.",NONE
366,38-1,Modern Coin Effects,Coin Through the Hat,2:12:14,3,170,,half penetrates handkerchief,NONE
367,38-1,Modern Coin Effects,Dime Delusion,2:24:12,3,171,,Three coins vanish from a pill box and wind up inside a bag in a box in another box all sealed by rubber bands.,NONE
368,38-1,Modern Coin Effects,Tom Osborne's Five Coin Routine,2:30:56,3,173,,Similar to French Pill Box Coin Mystery.,NONE
369,38-1,Modern Coin Effects,"The ""Throw-Away"" Coin Vanish",2:51:29,3,176,,Three methods of performing a vanishing coin,NONE
370,38-1,Modern Coin Effects,The Chameleon Poker Chips,2:53:59,3,177,,Coin penetrates hat repeatedly.,NONE
371,39-1,Fundamental Card Sleights,Le Paul's Pass,0:00:09,3,181,---,bring card from center to top,NONE
372,39-1,Fundamental Card Sleights,Side-Bottom Pass,0:09:41,3,183,---,card from center to bottom,NONE
373,39-1,Fundamental Card Sleights,Frank Kelly's Bottom Placement,0:15:41,3,184,---,cards selected by riffle end up on bottom,Frank Kelly
374,39-1,Fundamental Card Sleights,Card Through the Magazine,0:17:57,3,187,---,"Card appears in magazine, uses Kelly's Bottom Placement",NONE
375,39-1,Fundamental Card Sleights,Tommy Dowd's Card in the Pocket,0:28:56,3,188,---,another use of Bottom Placement,Tommy Dowd
376,39-1,Fundamental Card Sleights,Multiple Card Pass,0:30:53,3,192,---,Jacket pocket is shown empty but secretly loaded,NONE
377,39-1,Fundamental Card Sleights,Simplex Card in Pocket,0:36:05,3,191,---,method to bring variety of cards to top or bottom,NONE
378,39-1,Fundamental Card Sleights,False Cut Routine,0:46:17,---,---,---,Not in Book,NONE
379,39-1,Fundamental Card Sleights,Direct False Cut,1:04:13,3,195,---,"A false cut technique where the magician appears to cut the deck of cards into two piles and reassemble them, giving the illusion of shuffling. However, the order of the cards remains unchanged.",NONE
380,39-1,Fundamental Card Sleights,Himber's False Cut,1:11:53,3,196,---,"A method of falsely cutting a deck of cards. The magician appears to shuffle the deck by lifting off a portion and placing it on the other end, but secretly maintains the original order of the cards.",NONE
381,39-1,Fundamental Card Sleights,Under-Cut False Cut,1:13:46,3,197,---,"A method of falsely cutting a deck of cards. The magician appears to shuffle the deck by dividing it into two piles and rejoining them, but secretly keeps the cards in their original order.",NONE
382,39-1,Fundamental Card Sleights,Paul Rosini's False Cut,1:15:41,3,197,---,"A method of falsely cutting a deck of cards. The magician appears to shuffle the deck by dividing it into three sections and then reassembling them, but in a way that secretly maintains the original order of the cards.",Paul Rosini
383,39-1,Fundamental Card Sleights,E-Z Three-Way False Cut,1:17:11,3,199,---,"A method for making a deck of cards appear to be shuffled while secretly keeping the cards in the same order. The magician divides the deck into three piles and reassembles them in a way that seems to mix the cards, but actually leaves them in their original sequence.",NONE
384,39-1,Fundamental Card Sleights,Joe Berg's False Cut,1:20:35,3,200,---,"A method of falsely cutting a deck of cards. The magician appears to shuffle the deck by dividing it into three sections and then reassembling them, but in a way that secretly maintains the original order of the cards.",Joe Berg
385,39-1,Fundamental Card Sleights,False Counts,1:23:06,---,---,---,,NONE
386,39-1,Fundamental Card Sleights,Direct False Count,1:23:09,3,201,---,audible. Count several cards as many,NONE
387,39-1,Fundamental Card Sleights,Slip-Over False Count,1:26:46,---,---,---,sliding card back. As above.,NONE
388,39-1,Fundamental Card Sleights,Put-Back False Count,1:30:38,3,204,---,"Count off many, really remove few",NONE
389,39-1,Fundamental Card Sleights,Pick-Up False Count,1:33:15,3,205,---,Count off less than dealt,NONE
390,39-1,Fundamental Card Sleights,Palm-Over False Count,1:37:07,3,206,---,Deal fewer cards than counted,NONE
391,39-1,Fundamental Card Sleights,Glide False Count,1:39:08,3,207,---,Deal fewer cards than counted,NONE
392,39-1,Fundamental Card Sleights,Over-Hand False Count,1:41:26,3,209,---,runoff makes small packet seem large,NONE
