ID,LESSON,SUBJECT,TITLE,TIMESTAMP,VOLUME,PAGE,DESCRIPTION,BOOK_DESCRIPTION,INVENTOR
579,57-1,Slate Mysteries Vol 1,Numbered Double-Slate Writing,0:45:37,4,386,"Spectator selects landmark from magazine. Spectator writes down what the landmark is on one dry-erase board and puts their initials on it.  Magician puts his initials on another dry-erase board.  Just by waving the marker near his board, the magician draws an image of the landmark.","The magician writes numbers on each side of the slates and then places them together. When the slates are separated, a message has magically appeared on one of them.  Flap slates, forcing deck",NONE
580,57-1,Slate Mysteries Vol 1,Simplex Double Slates,0:59:04,4,389,"Spectator thinks of favorite playing card and hold onto card deck.  Magician pulls out 2 blank cards. Spectator pulls out their favorite card from the deck and lays it on the table. Spectator hold onto the 2 blank cards while thinking of the face of the card.  When they flip the cards over, a dim, slightly blurry image of their favorite card is shown to have appeared. They then think of the back of the card and when flipped over, the playing card back has appeared.  The spectator gets to keep the card. ","The magician shows both slates to be blank, places them together with a piece of chalk inside, and then has a spectator hold them. When the slates are opened, a message has mysteriously appeared on one of them.  No flap",NONE
581,57-1,Slate Mysteries Vol 1,Single-Slate Writing,1:17:24,4,390,Word written on dry-erase board instantly changes. (blackart),"The magician shows the slate to be blank on both sides. They then place the slate on the table in full view of the audience, and a message mysteriously appears on it.  Flap",NONE
582,57-1,Slate Mysteries Vol 1,Transfer Single-Slate Writing,1:24:00,4,391,"ESP cards are selected by a spectator and the magician consistently draws the selected symbol correctly.  Then other spectators select a card and the original spectator is going to draw an image in the air, the magician ""fixes"" the image and magically makes the image appear on the dry-erase board","The magician gives the slate to a spectator to examine and then seemingly washes it clean. They wrap the slate in newspaper and give it back to the spectator. When the spectator removes the paper, a message has magically appeared on the slate.",NONE
583,57-1,Slate Mysteries Vol 1,A Visible Message,1:39:22,4,392,5 cards with symbols indicating sports are shown and spectator selects one.  Magician writes down a sport on a dry-erase board and gets it wrong.  He writes another and gets it wrong.  Spectator erases board to reveal an image of the sport.,"The magician shows the slate to be blank, and then a message mysteriously appears on it in full view of the audience. It seems as if the message writes itself with no visible means of how it got there.  Onion juice",NONE
584,57-1,Slate Mysteries Vol 1,Dobrin's Double Locking Slate/Magic Square,1:50:56,4,392,Spectator writes a 2-digit number. Magician draws a 4x4 matrix. Magician writes random numbers into the matrix very quickly.  All 4 numbers equal the spectator's selected number. ,"A special slate that allows the magician to seemingly produce a message on its surface without ever touching it. The magician shows the slate, and a message mysteriously appears, even though the slate appears to be locked and untouched. This creates a puzzling illusion of a message appearing from nowhere.  Hinged flap",NONE
585,57-2,Slate Mysteries Vol 2,Larsen and Wright Double Message,0:00:10,4,394,"Greeting card is shown on both sides and placed in an envelope.  When pulled back out, it has ""Thank You"" on one side and ""Good Night"" on the other.","The magician shows both sides of the slate and the cardboard to be blank. When the cardboard is held in front of the slate for a moment, a message mysteriously appears on the slate.",NONE
586,57-2,Slate Mysteries Vol 2,Jack Miller Slate Routine,0:06:01,4,396,"2 white boards and a marker are passed out for examination.  They are all handed back to magician. All sides of both boards are clearly numbered 1-4.  One of the numbers is freely selected.  ""2"" becomes the ""Target"". ""4"" becomes the ""Send"" button. ""3"" gets a list of random numbers on it from the audience.  When the random numbers are totalled, ""4"", the ""Send"" button, is pressed and ""1"" is turned around to reveal the total already written on it.  ","The magician shows both sides of the slates, numbering each side to prove they are blank. However, at the end of the routine, a message mysteriously appears on one of the slates.",Jack Miller
587,57-2,Slate Mysteries Vol 2,Multiple Slate Writing,0:26:10,4,399,A list of random words is written by the audience.  A spectator is then handed the list of random words and freely selects one.  The magician never hears or sees the list.  The spectator simply thinks of the word.  The spectator is then shown blank business cards and asked to picture any letter from the word on the business card.  The magician correctly gets all the letters correct.  The magician then correctly puts the letters in order to spell the word that was freely thought of.,"The magician shows each slate to be blank on both sides, even numbering them with chalk. However, when the slates are turned over, a different message has magically appeared on each one.",NONE
588,57-2,Slate Mysteries Vol 2,A Spooky Message,0:42:39,4,402,"Cards are freely shuffled and one is placed face down on a dray erase board and another dry erase board is placed on top of it.  The spectator and magician both ""race"" to try to see who can guess it first.  The magician writes down ""The Name of The Card Is...""  He asks the spectator to erase the sentence, but only some of the letters erase to reveal the ACTUAL name of the card.","a spectator's freely chosen playing card is revealed in a spooky way. The spectator selects a card and places it face down on a slate. The magician then writes ""THE NAME OF THE CARD IS"" on another slate and places it on top. When the slates are separated, the name of the chosen card has mysteriously appeared on the top slate.",NONE
589,57-2,Slate Mysteries Vol 2,Message on Paper,0:53:50,4,406,"Spectator shuffles deck and pulls off post-it note. Spectator selects card and places post-it not on color plate that matches the color of his card.  Magician puts both plates together face to face. Marker goes between them.  After shaking them a bit, plates are separated and black plate is flipped to reveal that the marker has written, by itself, the spectator's card value and suit.","a message appears on a sheet of paper. A blank piece of paper is shown and placed on a slate. Another slate is placed on top. When the slates are separated, a message has magically appeared on the piece of paper.",NONE
590,57-2,Slate Mysteries Vol 2,Chinese Comedy Slate Message,1:08:33,4,408,"Spectator writes their initials on a dry-erase board. Spectator selects a playing card with an ancient philosopher on it and asks a philosopher an existential question.  When they flip the board over, the answer is written, in Chinese, still with their initials on it.  ","A spectator writes their initials on the slate, and it's placed in an envelope. When the slate is removed, a funny message written in ""Chinese"" has appeared on it. The magician then gives a humorous interpretation of the message.",NONE
591,57-2,Slate Mysteries Vol 2,White Chalk of Many Colors,1:25:15,4,411,"Magician uses black marker to write words Hello, Red, Green, and Blue.  With a snap, the colors change from Black to the actual colors.","The magician pretends to write on the slate with white chalk, claiming it magically changes color. They write the words ""RED,"" ""GREEN,"" and ""BLUE"" in white. After a pause, they reveal that the words have indeed changed to their respective colors.",NONE
592,58-1,Illusions,"David Bamberg's ""The Girl from the Light""",0:00:10,4,413,"Variations of Shadowbox including construction, solo, and assistant performances",Girl appears in shadow box,David Bamberg
593,59-1,Unique Magic,Harrison's Knife Through Coat,0:00:10,5,13,"A very convincing knife through coat in which an X-acto knife makes a real hole in a shirt, passes through it, yet leaves no damage behind.","A knife seemingly penetrates a borrowed coat. A spectator's coat is held outstretched, a borrowed bill is placed on it, and the magician appears to push a knife through the bill and into the coat. The bill seems to be impaled on the knife, but is then removed unharmed, and the coat is also shown to be undamaged.",NONE
594,59-1,Unique Magic,"Frank Kelly's ""I Dood It""",0:18:51,5,22,"A borrowed dollar is torn to pieces and an apparent mistake turns into an opportunity for an unexpected, comedy restoration.",Torn and Restored napkin with comedy ending,NONE
595,59-1,Unique Magic,Hindu Yarn Mystery,0:28:49,5,27,"A version of the perennial favorite, broken and restored string, but using more visible yarn for stand-up and stage work.",Yarn torn to pieces and restored,NONE
596,59-1,Unique Magic,Mora's Travelling Marbles,0:37:24,5,30,"An elegant piece incorporating timing, misdirection, and sleight-of-hand... now updated to use common items you might find around your house.",Marbles travel 1 at a time from hat to hat,NONE
597,59-1,Unique Magic,"Edwin Tabor's ""Fourth Dimension"" Silks/""Gene"" Tarbell's ""Pull-Apart"" Silks/Martin Gardner's ""Pop-Up"" Cigarette/Martin Gardner's Immovable Cigarette",1:03:36,5,"37, 40, 52, 53",A devious modern method to instantly exchange one beverage for another while one is still sealed in the can.,Two different colored silks are tied together and pulled apart,NONE
598,59-1,Unique Magic,"""Penetra"" Silk",1:24:17,5,43,"A couple of quick silk penetrations, a full routine with a one-of-a-kind souvenir, and an instant exchange of a cigarette and a chosen card.",Silk disappears from glass to appear in clear box (uses commercial Crystal Casket),NONE
599,59-1,Unique Magic,Blackledge Card and Cigarette Change,1:58:00,5,47,,"Selected card has corner torn off and is rolled up like a cigarette. It changes into a cigarette, and the card is found in a cigarette case previously examined and now held by the spectator",NONE
600,59-1,Unique Magic,Bob Ellis' Thimble Production,2:15:02,5,56,A surprisingly sudden thimble appearance that's also pretty easy to do.,"One thimble produced, hands shown, suddenly 4 thimbles are shown",NONE
601,59-1,Unique Magic,Ed Reno's Ink to Water,2:21:26,5,57,A bit of mental magic which reveals another way to transform one drink into another to match the randomly chosen soda.,"Glass if ink shown, card dipped in and colored, ink changes to silk",NONE
602,59-1,Unique Magic,"Audley Walsh's ""King of (Nite) Clubs""",2:43:11,5,60,"A self-contained comical rising and transforming card character, updated to appeal to modern sensibilities.","3 Cards rise, one turns out with Al Jolson cutout",NONE
603,59-1,Unique Magic,Audley Dunham's Vanishing Coins,0:00:10,5,66,"A way to vanish multiple coins that fools not only the eyes, but also the ears.",Coins tossed into glass vanish,NONE
604,6-1,The Thumb Tip,Mystery of the Burning Cigarette ,0:00:10,1,118,Make burning cigarette vanish inside cloth,Lit cigarette dropped in handkerchief without harm.,NONE
605,6-1,The Thumb Tip,The Asbestos Palm,0:12:51,1,121,Make lit match vanish inside bare hand,Lit cigarette vanishes in magician's hand,NONE
606,6-1,The Thumb Tip,Burning a Borrowed Handkerchief ,0:16:32,1,122,"Destroy an object and restore it.  In this case, cut and restore wired earbuds.",Borrowed handkerchief is set on fire and yet remains undamaged.,NONE
607,6-1,The Thumb Tip,The Enchanted Paper,0:25:03,1,125,Make a dollar invisible and use another to make it visible again,"A strip of colored tissue paper seemingly disappears and reappears. The magician shows the paper, places it in their hand, and it vanishes. They then claim it's still there but invisible, and with a borrowed handkerchief, they magically produce the strip of paper from within the folds of the handkerchief.",NONE
608,6-1,The Thumb Tip,The Passe-Passe Salt,0:33:43,1,129,"Salt, poured in hand, vanishes and reappears","Salt disappears from left hand, poured from right",NONE
609,60-1,More Unique Mysteries,Dunham's Floating Ping Pong Ball,0:04:32,5,67,Learn one of life's most important lessons... how to impress your friends at a party with your mad levitating beer pong skills.,"A ping pong ball appears to float in mid-air. The magician holds the ball between their hands, and it mysteriously floats between their palms, seemingly defying gravity.",Audley Dunham
610,60-1,More Unique Mysteries,"Rufus Steele's ""A Flower for you""",0:11:52,5,69,"A truly unique way to find and produce signed, selected cards.","Cards are selected and returned. Three flowers are presented to the spectators, each with the selected card attached.",Rufus Steele
611,60-1,More Unique Mysteries,Ed Reno's Watch and Geranium,0:23:03,5,72,A borrowed object to impossible location... Could it be the shrub? Better check his roots.,"Borrowed watch vanishes from newspaper, appears in roots of potted plant",Ed Reno
612,60-1,More Unique Mysteries,Watch the Lemon,0:48:03,5,75,A strange arrangement of items instantly produces lemonade by completely removing the inside of a lemon without damaging the skin.,"Lemon transfer from glass to glass apparently fails, until it is found that the lemon is empty and the contents have transferred",NONE
613,60-1,More Unique Mysteries,Popping Corn in a Hat,1:13:03,5,78,Two different ways to magically make popcorn... for one person or the whole group.,"Raw corn placed in hat, candle held under, popcorn pops out",NONE
614,60-1,More Unique Mysteries,Tarbell's Quick Popper,1:23:39,5,83,Two different ways to magically make popcorn... for one person or the whole group.,"Raw corn placed in hat, candle held under, popcorn pops out, with wastebasket",Harlan Tarbell
615,60-1,More Unique Mysteries,"Gardner's ""Card Through the Handkerchief""",1:33:05,5,84,A signed card penetration through the case and a cloth.,"A chosen card seemingly penetrates a handkerchief. The magician has a card selected, places the deck in its case, and wraps it in a handkerchief. The chosen card then appears outside of the case and handkerchief, as if it has magically passed through the fabric.",NONE
616,60-1,More Unique Mysteries,"Carmen Damico's ""Toss Over Card""",1:42:52,5,86,A very fooling 1 card across,"Card placed on table, two others reversed and placed in the deck. Card on table vanishes as it is tossed at the deck, and is found between the reversed cards",Carmen Damico
617,60-1,More Unique Mysteries,Stanley Jak's Good Luck Card,1:53:47,5,89,Signed card to coin purse. Perfect for close up workers.,Selected card found folded inside coin purse,Stanley Jak
618,60-1,More Unique Mysteries,"Himber's ""Name Cards"" Karrell Fox's ""The Question is...""",2:02:47,5,"91, 96",Find multiple cards using your spectators names. A comedy card revelation with proper punctuation,"The magician uses the letters in a person's name to seemingly locate a chosen card. A card is selected and returned to the deck, and the cards are shuffled. The spectator names any person, and the magician deals cards for each letter of the name. Through a process of counting and eliminating cards based on the letters, the magician ultimately reveals the selected card. - A card is selected, remembered, and returned to the deck. The cards are shuffled, and the magician spreads them out on the table in the shape of a question mark. The dot at the end of the question mark is then revealed to be the selected card.",NONE
619,60-1,More Unique Mysteries,Leon Maguire's Newspaper Card Holder,2:20:23,5,93,"A stand-up, interactive pseudo-memory stunt using a one of a kind gimmick.","a secret card holder using a newspaper. By cutting slots in a folded newspaper and attaching a paper bag to the back, the magician can secretly hold and reveal cards during a magic trick. The newspaper appears ordinary, but it has hidden features that allow for surprising card revelations and manipulations.  Holder, stack, and servante ideas",Leon Maguire
620,60-1,More Unique Mysteries,"Tony Lopilato's ""Yeast"" Pack",2:42:27,5,97,Inflate the deck to change the color of any named card.,"The magician shows some playing cards, sprinkles something on them that looks like yeast, and wraps them in a handkerchief. The cards then appear to expand and rise up inside the handkerchief as if they are growing or being inflated.",Tony Lopilato
621,60-1,More Unique Mysteries,Tony Lopilato's Sympathetic Silks The Quick-Knot Silks Tony Lopilato's Snappy Knotting Silks,2:58:18,5,99-104,"A bunch of bandanas are brought together with socio-political commentary, and magic knots, to inspire you to think beyond the trick.",Cards spread and rise under handkerchief,Tony Lopilato
622,60-1,More Unique Mysteries,Gene Tarbell's Rubber Band Off String - Seymour Davis's Wand Through Handkerchief - Wand Through the Hat,3:23:09,5,104-110,A giant nail is used to make a convincing point with three perplexing penetrations before being bent bare-handed and presented to your participant.,"A rubber band seemingly comes off a string while the ends are held by a spectator. The magician threads a rubber band onto a string held taut by a spectator. They cover the band with a handkerchief and then remove the handkerchief to show the band is no longer on the string, even though the spectator never let go of the ends. - a wand or stick seemingly penetrates a hat. The magician places a hat upside down on a table and pushes a wand or stick directly through the crown of the hat. Despite this seemingly impossible action, the hat remains unharmed. - a wand or stick seems to pass through a handkerchief. The magician spreads a handkerchief over their fist, creating a well or indentation in the fabric. They then push the wand through the well, seemingly penetrating the handkerchief. However, the handkerchief remains unharmed, adding to the mystery of the illusion.",Gene Tarbell
623,60-1,More Unique Mysteries,Max Malini's Egg Bag,3:45:57,5,110,You'll learn the secret of the Malini Egg Bag causing an egg to vanish and re-appear with incredible ease.,"Discussion of Malini's bag. Comparison with Albini bag. Short ideas, but no full routine provided.",Max Malini
624,61-1,Four Ace Effects,Conus' Aces,0:00:09,5,114,An early version of the ace transposition which makes it look like you can steal the aces away from under someone's hand.,4 Aces placed face down. 4 Cards from pack switch,NONE
625,61-1,Four Ace Effects,Simple Four-Ace Routine,0:11:29,5,115,A classic four ace assembly.,"4 aces on table, 4 others added. Aces assemble",NONE
626,61-1,Four Ace Effects,Ed Marlo's Simplex Aces,0:18:49,5,117,A convincing ace assembly version by Ed Marlo using a versatile switch.,"4 Aces dealt, 4 others, Aces assemble (no palm)",Ed Marlo
627,61-1,Four Ace Effects,Grant's Four-Ace Routine,0:24:11,5,119,"Next, Gen Grant gives you a non-sleight-of-hand method","4 Aces dealt, 4 others, mixed, put in pack and re-dealt. Assemble!",NONE
628,61-1,Four Ace Effects,Paul Rosini's Ace Transposition,0:37:01,5,121,An incredible transposition now improved with a couple of extra kickers.,"4 Aces removed from deck, appear face down in deck, tabled cards are now indifferent cards!",Paul Rosini
629,61-1,Four Ace Effects,Ed Marlo's Face-Up Ace-Embly,0:46:36,5,123,A way to make the aces instantly gather together and reverse themselves in the middle of the deck.,4 Aces spread through deck. Assemble together,Ed Marlo
630,61-1,Four Ace Effects,Larson's Aces,0:54:11,5,127,"An effective, and versatile, sequence to make four cards all appear to be the same before revealing their true identities.","One card selected, not revealed. Spectator points to any card, all 3 moved to top through deck and turn into Aces.",NONE
631,61-1,Four Ace Effects,Christopher's Red and Black Aces,0:59:17,5,129,Make the red and black aces change places in the blink of an eye.,"4 Ace of Spades shown, turn to 4 regular Aces",NONE
632,61-1,Four Ace Effects,"""Chic"" Schoke's Hippity Hop Aces",1:03:27,5,131,"A unique, visual way to make the aces change places.",Red and Black Aces transpose,NONE
633,61-1,Four Ace Effects,Audley Walsh's Ace Assembly,1:06:48,5,133,"An incredibly deceptive technique which allows the aces, distributed in a fan, to instantly come together on the top of the deck with no sleight-of-hand.",4 Aces transpose in the hands,Audley Walsh
634,61-1,Four Ace Effects,Barnhardt's Four-Ace Opener,1:11:41,5,134,Cut to the four aces from a shuffled pack.,Aces distributed in pack assemble,NONE
635,61-1,Four Ace Effects,Ed Marlo's Four-Ace Opener,1:15:01,5,134,"Visually produce the four aces, by having the aces ""kiss"".","4 packets dealt, top of each is an Ace",Ed Marlo
636,61-1,Four Ace Effects,Ed Marlo's General Ace Opener,1:23:17,5,136,"Find the four aces from a shuffled deck, using only one hand.",Indifferent cards change to 4 Aces,Ed Marlo
637,61-1,Four Ace Effects,Ed Marlo's One-at-a-Time Aces,1:31:37,5,138,A great assembly where you see the aces appear one-at-a-time.,"four Aces magically gather together. The magician places the four Aces separately on the table, with some face-up and some face-down. They then deal indifferent cards onto the Aces. Through a series of magical moves, the Aces vanish from three of the piles and assemble under the fourth pile, creating a surprising and seemingly impossible gathering of the Aces.",Ed Marlo
638,61-1,Four Ace Effects,"Joe Berg's ""Magician Makes Good""",1:39:58,5,126,"And the aces make a surprise appearance when a spectator tries to guess their card. Turns out it's an ace, so naturally the other cards change to match it.","4 Aces dealt, 3 cards on each, Aces Assemble",Joe Berg
639,61-1,Four Ace Effects,H. Adrian Smith's Penetrative Aces,1:45:11,5,141,"An unusual (seldom seen) penetration effect, where the aces travel through the close up mat to join the rest, underneath the spectators wallet.",Aces Penetrate newspaper in matrix,NONE
640,61-1,Four Ace Effects,The Conjurer's Four-Ace Mystery,1:52:11,5,146,"One of the most famous ace assemblies ever, where each one is clearly seen until it vanishes from its packet to join the leader ace.",Gimmicked 4 Ace Assembly,NONE
641,62-1,Modern Mental Mysteries Vol 1,Dai Vernon's Message in the Flames,0:00:10,5,149,A method from Dai Vernon to secretly read information (apparently destroyed) right in front of the audience.,"Message is burned, magician reveals",Dai Vernon
642,62-1,Modern Mental Mysteries Vol 1,Dai Vernon's Mental Prediction,0:15:23,5,152,"A way to literally predict exactly what someone will write, and they can write absolutely anything they want.",Center tear steal,Dai Vernon
643,62-1,Modern Mental Mysteries Vol 1,Dai Vernon's Magazine Test,0:33:19,5,154,"A perfect page force you can do with any magazine, and this particular presentation pays off with a perplexing production.","Card inserted in magazine, magician describes page (force)",Dai Vernon
644,62-1,Modern Mental Mysteries Vol 1,Frank Kelly's Magazine and Picture Test,0:50:40,5,159,Using a magazine and some numbered picture cards you can make a winning bet on something your spectator is only thinking of.,ESP cards used to pick page,Frank Kelly
645,62-1,Modern Mental Mysteries Vol 1,"Newmann's ""Super-Divino"" Sealed Letter Test",1:10:52,5,163,"Learn how to reval a spectators birthday, social security number, even their secret code to unlock their phone.","4 spectators write numbers on pad, a 5th number is added to them. All sealed in envelope. Magician states total and each individual number.",NONE
646,62-1,Modern Mental Mysteries Vol 1,"Braunhut's ""Thoughts Afire""",1:37:44,5,166,"A streamlined, ungimmicked, full peek of any post-it note.",Message sealed in envelope is burned and read,Harold Braunhut
647,62-1,Modern Mental Mysteries Vol 1,Double Envelopes,2:15:42,5,177,"Learn how to make an incredibly versatile envelope which can be handed out to your audience, yet it allows you to force or exchange information with no suspicious moves.",Number on slate matches number of words in advertisement,NONE
648,62-1,Modern Mental Mysteries Vol 1,"Harold Braunhut's ""Ad-Venture""",1:51:24,5,170,Predict an upcoming event that your spectator is only thinking of.,"a mentalism trick using newspaper want ads. A spectator cuts out and mixes up a bunch of want ads, and several people choose ads and seal them in envelopes. The mentalist then seemingly reads the mind of a spectator who has chosen one of the envelopes and reveals the contents of the selected ad without ever looking at it.",Harold Braunhut
649,62-1,Modern Mental Mysteries Vol 1,Reading the Number on a Borrowed Dollar Bill,2:32:32,5,178,Reveal the serial number of a borrowed dollar bill.,"a mentalism trick where the magician seemingly reveals the serial number of a borrowed dollar bill. The spectator places their bill in an envelope, and the magician, without ever seeing the bill, correctly recites its serial number.",NONE
650,62-2,Modern Mental Mysteries Vol 2,The Impossible Prediction,0:00:10,5,179,"A triple coincidence finds a random helper predicting a chosen cocktail, and you provide all the right ingredients.","Magician predicts a future event. A spectator makes a free choice from a selection of possibilities, and the magician reveals that they had already predicted the exact outcome, seemingly demonstrating precognition or an ability to see the future.",NONE
